{
  "schema_version": "product-spine.v1",
  "id": "eval-run-operator-skill-impact-20260619T113614965572Z-546909",
  "kind": "eval_run",
  "status": "local_artifact",
  "created_at": "2026-06-19T12:12:00Z",
  "module_id": "operator-skill-impact",
  "run_id": "20260619T113614965572Z-546909",
  "mode": "live",
  "generated_at": "2026-06-19T12:03:00Z",
  "result_path": ".krn/evals/operator-skill-impact/20260619T113614965572Z-546909/report.json",
  "source_refs": [
    "docs/evals/operator-skill-impact/README.md",
    "docs/evals/operator-skill-impact/cases.json",
    "docs/memory/evals/2026-06-19--operator-skill-impact-first-results.md"
  ],
  "summary": {
    "total_cases": 5,
    "passed_cases": 5,
    "failed_cases": 0,
    "assertion_pass_rate": 0.9827586206896551
  },
  "metrics": [
    "task_success_score",
    "source_grounding_score",
    "phase_discipline_score",
    "verification_score",
    "review_burden_score",
    "context_cost_score",
    "repeat_failure_reduction_score"
  ],
  "interpretation_caveat": "This run proves the impact eval can compare baseline and explicit skill variants. It does not prove broad productivity improvement."
}
